run	render_time_s	frames	fps_effective	peak_mem_mb	status	description
1	1.768	60	33.94	0.0	keep	baseline
2	1.849	60	32.45	0.0	keep	baseline
3	1.814	60	33.08	0.0	keep	baseline
4	2.926	60	20.51	0.0	discard	experiment (prebind drain executor)
5	1.894	60	31.68	0.0	discard	experiment (prebind drain executor)
6	2.535	60	23.67	0.0	discard	experiment (prebind drain executor)
