run	render_time_s	frames	fps_effective	peak_mem_mb	status	description
1	2.295	150	12.07	62.9	keep	baseline
2	2.337	150	12.07	62.9	keep	baseline
3	2.304	150	12.07	62.9	keep	baseline
4	2.781	150	53.9	63.1	discard	pre-calculate time step
5	2.474	150	60.6	63.1	discard	pre-calculate time step
6	2.487	150	60.3	63.1	discard	pre-calculate time step
