run	render_time_s	frames	fps_effective	peak_mem_mb	status	description
1	2.825	150	53.09	62.8	keep	baseline
2	2.762	150	54.30	62.7	keep	baseline
3	3.756	150	39.94	62.7	keep	baseline
4	2.726	150	55.02	62.7	keep	baseline
5	2.760	150	54.35	63.0	discard	PERF-676: bypass virtual time budget assignment
6	2.746	150	54.63	63.0	discard	PERF-676: bypass virtual time budget assignment
7	2.624	150	57.17	63.0	discard	PERF-676: bypass virtual time budget assignment
8	2.495	150	60.12	62.7	discard	PERF-676: bypass virtual time budget assignment
